### ISSUE TITLE
Unanswered ARP Requests on the ZeroTier Virtual Network Device

### ISSUE THREAD

**Issue by DarkArc** [zerotier/ZeroTierOne#2269]
# Issue Description

Connections (recently) seem to be having intermittent issues. When running a tcpdump on the ZeroTier device ARP requests are the only traffic making it through.

```
# XXX.YYY.1.2 is running ZeroTier and performs routing to a LAN device
ssh <LAN device reachable via XXX.YYY.1.2>
[repeat]
```
```
listening on <zerotier network device>, link-type EN10MB (Ethernet), snapshot length 262144 bytes
[broken]
13:49:59.224896 ARP, Request who-has XXX.YYY.1.2 tell devicehostname, length 28
13:50:00.236989 ARP, Request who-has XXX.YYY.1.2 tell devicehostname, length 28
13:50:01.260979 ARP, Request who-has XXX.YYY.1.2 tell devicehostname, length 28
13:50:04.997117 IP6 devicehostname.48227 > ff12::8384.21027: UDP, length 639
13:50:04.997537 IP devicehostname.44070 > XXX.YYY.255.255.21027: UDP, length 639
13:50:11.335450 ARP, Request who-has XXX.YYY.1.2 tell devicehostname, length 28
13:50:12.396983 ARP, Request who-has XXX.YYY.1.2 tell devicehostname, length 28
13:50:13.420982 ARP, Request who-has XXX.YYY.1.2 tell devicehostname, length 28
13:50:19.920144 ARP, Request who-has XXX.YYY.1.2 tell devicehostname, length 28
13:50:20.972999 ARP, Request who-has XXX.YYY.1.2 tell devicehostname, length 28
13:50:21.996979 ARP, Request who-has XXX.YYY.1.2 tell devicehostname, length 28
13:50:34.996735 IP6 devicehostname.48227 > ff12::8384.21027: UDP, length 639
13:50:34.997214 IP devicehostname.44070 > XXX.YYY.255.255.21027: UDP, length 639
13:51:04.997608 IP6 devicehostname.48227 > ff12::8384.21027: UDP, length 639
13:51:04.997747 IP devicehostname.44070 > XXX.YYY.255.255.21027: UDP, length 639
13:51:09.943530 ARP, Request who-has XXX.YYY.1.2 tell devicehostname, length 28
13:51:10.956984 ARP, Request who-has XXX.YYY.1.2 tell devicehostname, length 28
13:51:11.980980 ARP, Request who-has XXX.YYY.1.2 tell devicehostname, length 28
13:51:34.996955 IP6 devicehostname.48227 > ff12::8384.21027: UDP, length 639
13:51:34.997329 IP devicehostname.44070 > XXX.YYY.255.255.21027: UDP, length 639
13:52:04.997903 IP6 devicehostname.48227 > ff12::8384.21027: UDP, length 639
13:52:04.998052 IP devicehostname.44070 > XXX.YYY.255.255.21027: UDP, length 639
13:52:34.997914 IP6 devicehostname.48227 > ff12::8384.21027: UDP, length 639
13:52:34.998342 IP devicehostname.44070 > XXX.YYY.255.255.21027: UDP, length 639
13:52:57.814714 ARP, Request who-has XXX.YYY.1.2 tell devicehostname, length 28
13:52:58.014552 ARP, Reply XXX.YYY.1.2 is-at 6e:2f:47:0a:88:51 (oui Unknown), length 28
[now working!]
```

It seems like perhaps there's something going wrong with ZeroTier's handling of ARP requests on Linux? Perhaps something else is going on here?

# System Information

Local ZeroTier version: 1.12.2
Remote ZeroTier version: 1.10.6

```
System:
  Host: devicehostname Kernel: 6.7.11-200.fc39.x86_64 arch: x86_64 bits: 64
  Desktop: KDE Plasma v: 5.27.11 Distro: Fedora Linux 39 (KDE Plasma)
```

**Comment by DarkArc** [comment]
We've updated the remote to ZeroTier 1.12.2 and rebooted the machine; we'll see if this affects the issue.

**Comment by laduke** [comment]
How many members on the network?

**Comment by DarkArc** [comment]
There are 15 nodes on the network.

**Comment by laduke** [comment]
Should be fine. Did someone flow rules for that network get changed recently? Or the firewall rules on that node?

**Comment by DarkArc** [comment]
No changes to the firewalls or the node (sorry for the delay, I was checking with my colleagues to make sure they hadn't changed anything).

It's interesting that it's been fairly regular (as in every few days someone is seeing from their machine to this machine) but sporadic.

So far I haven't had any reports of issues or had any myself (following the update + reboot). I've got a TODO item to circle back in (at most) 30 days (to make sure I report back if it's cleared up).

I haven't seen anything in the ZeroTier changelogs that would suggest any changes in this area between 1.10.6 and 1.12.2; so it would be kind of strange if the update fixed something here.

**Comment by DarkArc** [comment]
Just saw this today for the first time since the report/update; so it's not resolved by updating to 1.12.2 or by the reboot. It does seem like it _might_ take a significant amount of uptime before it manifests.

```
# Uptime for XXX.YYY.1.2
$> uptime
11:48:21 up 14 days, 18:46,  3 users,  load average: 0.04, 0.03, 0.00
```
```
# Uptime for my device / devicehostname
$> uptime
11:49:30 up 20:09,  1 user,  load average: 0.84, 0.57, 0.59
```

**Comment by laduke** [comment]
sorry to ask, but are the peers directly connected when this happens?

**Comment by DarkArc** [comment]
I have no complaints with questions :)

It seems they're directly connected, yes.

**Comment by DarkArc** [comment]
One more _possibly_ relevant detail, the remote system is a [Raspberry Pi B+](https://www.pishop.us/product/raspberry-pi-3-model-b-plus/?src=raspberrypi).

_Maybe_ something x86 <-> ARM (or generally ARM) specific could be happening.

**Comment by DarkArc** [comment]
So, I'm seeing this again today. I updated the local device to ZeroTier 1.14 and I'm unable to reach the remote device.

The local device consistently reports a direct connection. The remote device is going back and forth between RELAY and DIRECT state to the local device.

This is a different "remote" and "local" device entirely I'm working with today (the local device being a Framework laptop and the remote device lives in AWS).

**Comment by DarkArc** [comment]
I've poked at this a little more:
```
Adding Route. target: RRR.QQQ.ZZZ.0/21 via: XXX.YYY.1.1/32 src: XXX.YYY.117.102/32 iface: <ztiface>
rtnetlink error: Network is unreachable
Adding Route. target: LLL.OOO.0.0/23 via: XXX.YYY.1.2/32 src: XXX.YYY.117.102/32 iface: <ztiface>
rtnetlink error: Network is unreachable
```

These then get periodically retried with simply:
```
rtnetlink error: File exists
```

**Comment by DarkArc** [comment]
Okay, so I think I finally figured this out!

The rtnetlink errors seem to be a red herrring. They still occur even when everything is working properly.

We have the following rules in the rules engine:
```
drop
	not ethertype ipv4
	and not ethertype arp
	and not ethertype ipv6
;

tag server
  id 2
  enum 0 No
  enum 1 Yes
  default No;

break not tor server 1;

accept;
```

This is intended to stop peer <-> peer communication between peers that don't absolutely need to talk. What it seems like is happening is the ARP request are getting caught in this rule.

I've changed that break to the following to explicitly allow ARP requests:
```
break not tor server 1
     and not ethertype arp
;
```

I'm not sure if there's been a change in the rules engine or if something has happened in Linux's networking stack that is now making this necessary. However, I suspect this is the root cause.

I'm not sure if ZeroTier would like to change something about how the rules engine works here. It seems like that tag should still work (just not send the broadcast packet to the devices that aren't tagged with server).

**Comment by laduke** [comment]
oh good! 

That should actually be fixed in 1.14. but both systems need to up on 1.14

Most of the rules examples should have had arp exceptions in them to avoid people hitting this quirk. Sorry for the lost time. 
There is an issue in here somewhere that explains it all in way too much detail. 
#2200

**Comment by DarkArc** [comment]
Thanks for the details; I'm going to go ahead and close this.

I'll reopen if we run into problems again but I suspect this is resolved (by either 1.14 or explicitly by the rule changes).

**Comment by DarkArc** [comment]
Gah, sadly ... this was not the problem. I am again seeing the issue.

**Comment by DarkArc** [comment]
We've updated the remote machine to 1.14. I'll continue to keep an eye on this and report back whether that has an effect.

**Comment by DarkArc** [comment]
Saw this again today with both machines running 1.14.

I did note an interesting detail this time. The remote device was claiming to be directly connected at `<REMOTE_IP>/9993`. The problem with that is, there's almost no way it was actually accessible at `<REMOTE_IP>/9993` because the device is behind a router performing NAT.

When the ARP requests started getting resolved the device reported it was `<REMOTE_IP>/23380` (a randomly assigned port number that actually makes some amount of sense).

Any idea why it would be reporting `9993`?

**Comment by DarkArc** [comment]
I just noticed consistent NAT was not enabled on the SonicWall. I wonder if this is a case of the ZeroTier port mapping just being unstable and thus the port mapping is regularly expiring when there's a periodic of silence in the traffic.

I've changed that setting ... hopefully _that_ is the real issue. It's very strange that we weren't seeing a `RELAY` status or something of that ilk.

**Comment by DarkArc** [comment]
_Aha_, I think I found another piece of the puzzle. It seems there was a breakage in miniupnp on FreeBSD 15:

https://github.com/miniupnp/miniupnp/issues/715

This potentially explains why this disruption has been more prominent recently. My NAT presumably was _previously_ much more reliable where as now both NATs are not straight forward.

I hadn't noticed the full extent of this because my home network is IPv6 so only the limited number of devices that I have to connect to via IPv4 peer-to-peer were having issues.

**Comment by DarkArc** [comment]
I bumped into this again today. It recovered more quickly and it may still be related to non-ideal network conditions ... but something still seems to be off.

**Comment by CSymes** [comment]
> Okay, so I think I finally figured this out!
> ...
> break not tor server 1
>      and not ethertype arp

We had a very similar rule in our flow rules, and adding the ARP clause solved the issues I was running into, so a huge thank you for sharing this. I've been going mad chasing this down trying to figure out why things were behaving the way they were!

**Comment by DarkArc** [comment]
Unfortunately I can't say the same for our issue... I (just today) once again have had things get stuck in ARP requests.
