### ISSUE TITLE
ZeroTier One Linux init.d script does not always stop service

### ISSUE THREAD

**Issue by sbilly** [zerotier/ZeroTierOne#299]
There is port 9993 traffic when I stopped all related process 

```bash
# /etc/init.d/zerotier-one status
# /etc/init.d/zerotier-one stop
ZeroTier One is not running.
# ifconfig|grep link -i|grep -v  inet6
docker0   Link encap:Ethernet  HWaddr xx:xx:xx:xx:xx:xx
eth0      Link encap:Ethernet  HWaddr xx:xx:xx:xx:xx:xx
lo        Link encap:Local Loopback
veth0aa754f Link encap:Ethernet  HWaddr xx:xx:xx:xx:xx:xx
veth5c209db Link encap:Ethernet  HWaddr xx:xx:xx:xx:xx:xx
veth9879a95 Link encap:Ethernet  HWaddr xx:xx:xx:xx:xx:xx
# tcpdump port 9993
tcpdump: verbose output suppressed, use -v or -vv for full protocol decode
listening on eth0, link-type EN10MB (Ethernet), capture size 65535 bytes
09:01:53.119675 IP 192.168.31.150.9993 > cpe-98-24-26-122.carolina.res.rr.com.9993: UDP, length 4
09:01:53.119748 IP 192.168.31.150.9993 > 120.42.143.25.1396: UDP, length 135
09:01:53.119782 IP 192.168.31.150.9993 > ip70-186-164-63.br.br.cox.net.9993: UDP, length 4
09:01:53.119799 IP 192.168.31.150.9993 > 182.253.121.2.1391: UDP, length 4
09:01:53.119821 IP 192.168.31.150.9993 > 118.112.59.64.20375: UDP, length 4
09:01:53.119840 IP 192.168.31.150.9993 > us-relay-1.zerotier.com.2638: UDP, length 4
09:01:53.119865 IP 192.168.31.150.9993 > root-alice-sgp-01.zerotier.com.9993: UDP, length 4
09:01:53.119896 IP 192.168.31.150.9993 > ip72-194-68-118.oc.oc.cox.net.41276: UDP, length 4

8 packets captured
11 packets received by filter
0 packets dropped by kernel
```

**Comment by mcondarelli** [comment]
Check "ps ax | grep zero"
It happened to me more than once zerotier-one.pid was pointing to a bogus (most likely old) pid.
In that condition /etc/init.d/zerotier-one reports no zerotier, but one is running.

**Comment by adamierymenko** [comment]
Closing since Linux packages and init scripts have been completely redone in 'dev'.
