### ISSUE TITLE
Android starts using Google public DNS when ZT vpn established.

### ISSUE THREAD

**Issue by Chubukov-Aleksey** [zerotier/ZeroTierOne#519]
When ZeroTier One establishes vpn interface, whole Android system starts using Google Public DNS, completely ignoring network settings. Some internet providers like Maximatelecom blocks queries to non-provider's DNS servers. 

when ZT is down: 
$ getprop net.dns1
10.1.1.10
$ getprop net.dns2
10.1.1.11
$ curl github.com
tcpdump port 53:
12:56:42.950745 IP 10.65.130.202.1244 > 10.1.1.10.domain: 3102+ AAAA? github.com. (28)
12:56:42.971445 IP 10.1.1.10.domain > 10.65.130.202.1244: 3102 0/1/0 (112)
12:56:42.971723 IP 10.65.130.202.46197 > 10.1.1.10.domain: 61959+ A? github.com. (28)
12:56:43.033475 IP 10.1.1.10.domain > 10.65.130.202.46197: 61959 2/0/0 A 192.30.253.113, A 192.30.253.112 (60)

When ZT is connected:
$ getprop net.dns1
10.1.1.10
$ getprop net.dns2
10.1.1.11
$ curl github.com
curl: (6) Couldn't resolve host 'github.com'
tcpdump port 53:
13:00:18.192806 IP 10.65.130.202.5960 > 8.8.8.8.domain: 5210+ A? github.com. (28)

Tested on CyanogenMod 12.1-20161016-NIGHTLY-amami

**Comment by glimberg** [comment]
Sorry for the delayed reply.  We have a totally redesigned UI for the Android app coming soon.  Part of that is the ability to set custom DNS servers (or just use what is already configured on the device).  I'm actually working on the DNS settings right now.  Once done it'll be posted to the Play store in the Beta channel.

**Comment by Chubukov-Aleksey** [comment]
Beta from Play store now works fine. Thank you.
