### ISSUE TITLE
Android app connects only sometimes

### ISSUE THREAD

**Issue by ivan4th** [zerotier/ZeroTierOne#781]
ZeroTier works for me just fine on Linux and Mac OS X, but on Android I mostly get this
after recent update (1.2.10-1): https://i.imgur.com/94ySNkM.jpg

It says "ONLINE" at the bottom on the main screen at the same time, but "key" status icon doesn't appear.

Before the update, I was able to connect while being on WiFi, but on cellular data the connection was only happening if I connected using WiFi before that, despite "Use cellular data" being checked. The cellular did work properly some time ago, but I don't recall when exactly it got broken.

The actual connection happens only maybe single time out of 10-15 attempts.

Android 8.0.0, OnePlus 3T

Any hints on how I can debug the problem?

**Comment by ivan4th** [comment]
It did work but only if I was switching zerotier network to "online" while on wifi. If I was using cellular data, I didn't get key icon. Update: right now it seems to have reverted to that behaviour with 1.2.10-1, maybe because I'm on a different WiFi network right now. I.e. still can only work on cellular if I connect to the network while on WiFi before that, otherwise it stays in REQUESTING_CONFIGURATION. Don't know if it can be related to IP blacklisting in Russia, what IPs should I ping to check? I know some of the root servers are blocked, but not all of them (6 or 7 are available), perhaps should try to check the controller IP?

**Comment by mvartanyan** [comment]
Same issue here - zerotier app (1.2.10-1) appears to connect successfully, is ONLINE, knows its network name, managed IPs etc, just the key icon is not there... and there is no actual connectivity with the zerotier network.  Samsung Galaxy Alpha, Android 5.0.2. Exact same setup on another phone with Android 7.0 works without any issues.

**Comment by ivan4th** [comment]
I did observe slow startup on Mac, too. The actual issue in my case seems to be that some of the root endpoints are blocked by `!@#$#$$%#^` Russian govt censorship, and zt slowly tries them in sequence till it finds a working one. I'm not sure how this can be fixed, perhaps by caching last working endpoint(s) or smth like that.

**Comment by mvartanyan** [comment]
Hi @ivan4th jfyi the problem with Android app on an older Android version is observed from Germany. So this one probably doesn't have much to do with blocked IPs of root endpoints.

**Comment by ivan4th** [comment]
I can add the following observations atm:

1. The issue still persists for me. Sometimes the connection happens quickly, sometimes it doesn't.
2. I've travelled to US and Hungary since I've reported this issue, and the problem *doesn't happen* there.
3. In one of my networks I have some of the bigger blocked subnets routed through a OpenVPN to Italy and, in this network, mobile ZeroTier also connects quickly.

I don't observe the issue on Linux/Mac OS X/Windows ZeroTier most of the time for some reason.
I think the Android version gets stuck if some of the roots can't be contacted. This likely can be reproduced on a mobile device by blocking e.g. half of the roots on the router it connects too (as per `-j DROP` in iptables). I'd say this issue may also concern countries w/o this stupid Internet censorship in case if some of the roots go down (with some luck, even single root failing may affect some of the users).

**Comment by ivan4th** [comment]
For reference, here are root IPs that work / are blocked in Russia right now:
```
188.166.94.177  blocked
154.66.197.33   works
159.203.97.171  blocked
131.255.6.16    works
107.170.197.14  works
128.199.197.217 blocked
45.32.198.130   works
46.101.160.249  blocked
107.191.46.210  works
45.32.246.179   works
45.32.248.87    works
159.203.2.154   blocked
```
(the most damage came from Roskomnadzor idiots blocking most of Digital Ocean networks during their demented hunt after Telegram)

Controller IPs that are currently in use on my Mac aren't blocked (don't know how to check these on Android)
```
ivan4th@i4mac:~$ zerotier-cli listpeers|grep 5657
200 listpeers 565799d8f6 35.236.106.39/21007;13023;13023 -1 1.2.13 LEAF
ivan4th@i4mac:~$ zerotier-cli listpeers|grep c7c8
200 listpeers c7c8172af1 35.236.10.22/21021;7667;7667 182 1.2.13 LEAF
ivan4th@i4mac:~$ zerotier-cli listpeers|grep 93af
200 listpeers 93afae5963 35.236.103.193/59948;14191;14191 -1 1.2.13 LEAF
```

**Comment by ivan4th** [comment]
So in case there'll be some time to look into the issue... I've captured some traffic from my Android phone using my Mac + sharing the internet connection via WiFi + tcpdump (gunzip, then use `tcpdump -r`, wireshark, etc.)
Here's initial attempt:
[zerotier-tcpdump.gz](https://github.com/zerotier/ZeroTierOne/files/2928835/zerotier-tcpdump.gz)

Small excerpt:
```
03:58:24.149493 IP 192.168.3.4.9993 > 188.166.94.177.9993: UDP, length 137
03:58:24.151662 IP 192.168.3.4.9993 > 107.170.197.14.9993: UDP, length 137
03:58:24.256433 IP 45.32.248.87.9993 > 192.168.3.4.9993: UDP, length 59
03:58:24.256435 IP 45.32.248.87.9993 > 192.168.3.4.9993: UDP, length 41
03:58:24.344991 IP 107.170.197.14.9993 > 192.168.3.4.9993: UDP, length 59
03:58:24.344994 IP 107.170.197.14.9993 > 192.168.3.4.9993: UDP, length 41
03:58:24.355725 IP 192.168.3.4.9993 > 188.166.94.177.9993: UDP, length 137
03:58:24.357853 IP 192.168.3.4.9993 > 107.170.197.14.9993: UDP, length 137
```
In this case, `188.166.94.177` (`root-alice-ams-01.zerotier.com`) is blocked and not responding.
45.32.248.87 (`root-bob-tok-01.zerotier.com`) and 107.170.197.14 (`root-alice-sfo-01.zerotier.com`) do respond but this is somehow not enough (?)

Here's an attempt after removing and re-adding the network which seemed to help sometimes (? not sure about that) but didn't help that time:
[zerotier-tcpdump-1.gz](https://github.com/zerotier/ZeroTierOne/files/2928834/zerotier-tcpdump-1.gz)

In some cases, I get the key icon immediately, in other cases, it comes up after a couple of minutes, and sometimes it doesn't come up at all. I suspect there may be some long timeouts at play, so maybe rooting the phone and doing smth like `iptables ... -j REJECT` may help b/c "destination port unreachable" may make the responsible parts of zerotier code fail faster. Will maybe try this by reconfiguring the router

**Comment by ivan4th** [comment]
Right now it looks like zt app may "stumble" if some / any of the roots its tries are unreachable (maybe even one of them?)

**Comment by ivan4th** [comment]
@adamierymenko the problem is still there, why closing the task?.. zt doesn't seem to handle unreachable roots very well. And, btw, for some reason mobile app seems to be more problematic in this respect (even w/o moons, non-android clients connect much faster)
