### ISSUE TITLE
Link-Local Multicast Name Resolution

### ISSUE THREAD

**Issue by heri16** [zerotier/ZeroTierOne#284]
I am using LLMNR to replace Netbios Hostname lookup on Zerotier IPv6 network using zt assign-mode. Seems that LLMNR multicast does not work on Zerotier v1.1.2

https://en.wikipedia.org/wiki/Link-Local_Multicast_Name_Resolution

**Comment by heri16** [comment]
TCPdump from host requesting name resolution:

PS C:\Users\Administrator\Downloads> .\WinDump.exe -n 'udp port 5355'
C:\Users\Administrator\Downloads\WinDump.exe: listening on \Device\NPF_{D5A31F7C-F34C-4466-B497-*****}
01:30:08.227181 IP6 FE80::498B:E7A4:5C59:1121.61983 > FF02::1:3.5355: UDP, length 42
01:30:08.227259 IP 10.0.0.10.61983 > 224.0.0.252.5355: UDP, length 42
01:30:12.061113 IP6 FE80::498B:E7A4:5C59:1121.53630 > FF02::1:3.5355: UDP, length 41
01:30:12.061189 IP 10.0.0.10.53630 > 224.0.0.252.5355: UDP, length 41
01:30:16.044612 IP6 FE80::498B:E7A4:5C59:1121.54513 > FF02::1:3.5355: UDP, length 41
01:30:16.044713 IP 10.0.0.10.54513 > 224.0.0.252.5355: UDP, length 41
01:30:18.499775 IP6 FE80::498B:E7A4:5C59:1121.61811 > FF02::1:3.5355: UDP, length 41
01:30:18.499840 IP 10.0.0.10.61811 > 224.0.0.252.5355: UDP, length 41
01:30:18.910712 IP6 FE80::498B:E7A4:5C59:1121.61811 > FF02::1:3.5355: UDP, length 41
01:30:18.910783 IP 10.0.0.10.61811 > 224.0.0.252.5355: UDP, length 41
01:30:21.574713 IP6 FE80::498B:E7A4:5C59:1121.50909 > FF02::1:3.5355: UDP, length 28
01:30:21.574777 IP 10.0.0.10.50909 > 224.0.0.252.5355: UDP, length 28
01:30:21.574901 IP6 FE80::498B:E7A4:5C59:1121.50375 > FF02::1:3.5355: UDP, length 28
01:30:21.574965 IP 10.0.0.10.50375 > 224.0.0.252.5355: UDP, length 28
01:30:21.984892 IP6 FE80::498B:E7A4:5C59:1121.50909 > FF02::1:3.5355: UDP, length 28
01:30:21.984953 IP 10.0.0.10.50909 > 224.0.0.252.5355: UDP, length 28
01:30:21.985027 IP6 FE80::498B:E7A4:5C59:1121.50375 > FF02::1:3.5355: UDP, length 28
01:30:21.985067 IP 10.0.0.10.50375 > 224.0.0.252.5355: UDP, length 28
01:30:25.404741 IP6 FE80::498B:E7A4:5C59:1121.51523 > FF02::1:3.5355: UDP, length 41
01:30:25.404810 IP 10.0.0.10.51523 > 224.0.0.252.5355: UDP, length 41
01:30:25.527681 IP6 FE80::498B:E7A4:5C59:1121.49334 > FF02::1:3.5355: UDP, length 42
01:30:25.527744 IP 10.0.0.10.49334 > 224.0.0.252.5355: UDP, length 42
01:30:25.938742 IP6 FE80::498B:E7A4:5C59:1121.49334 > FF02::1:3.5355: UDP, length 42
01:30:25.938813 IP 10.0.0.10.49334 > 224.0.0.252.5355: UDP, length 42
01:30:33.332641 IP6 FE80::498B:E7A4:5C59:1121.49365 > FF02::1:3.5355: UDP, length 42
01:30:33.332734 IP 10.0.0.10.49365 > 224.0.0.252.5355: UDP, length 42
01:30:37.305829 IP6 FE80::498B:E7A4:5C59:1121.55763 > FF02::1:3.5355: UDP, length 42
01:30:37.305901 IP 10.0.0.10.55763 > 224.0.0.252.5355: UDP, length 42
01:30:41.613619 IP6 FE80::498B:E7A4:5C59:1121.54083 > FF02::1:3.5355: UDP, length 42
01:30:41.613692 IP 10.0.0.10.54083 > 224.0.0.252.5355: UDP, length 42
01:30:45.576558 IP6 FE80::498B:E7A4:5C59:1121.49663 > FF02::1:3.5355: UDP, length 42
01:30:45.576649 IP 10.0.0.10.49663 > 224.0.0.252.5355: UDP, length 42
01:30:59.828991 IP6 FE80::498B:E7A4:5C59:1121.60721 > FF02::1:3.5355: UDP, length 24
01:30:59.829047 IP 10.0.0.10.60721 > 224.0.0.252.5355: UDP, length 24
01:31:00.238736 IP6 FE80::498B:E7A4:5C59:1121.60721 > FF02::1:3.5355: UDP, length 24
01:31:00.238793 IP 10.0.0.10.60721 > 224.0.0.252.5355: UDP, length 24

**Comment by adamierymenko** [comment]
Is this a result of #285 ?

**Comment by heri16** [comment]
Happy New Year 2016 Adam! How interesting to reply on the turn of the year! Yes, this should be related to #285 . May this year bring forth greater adoption and successes for zerotier!
