### ISSUE TITLE
ZT1 Linux keeps sending ARP on private ethernet interface

### ISSUE THREAD

**Issue by zcqian** [zerotier/ZeroTierOne#741]
I have a fresh installed Ubuntu Server 18.04 LTS, and installed ZeroTier One on it, and it has been configured to join my network, everything is working correctly.

However, on a private interface (say, `ens7`) connected to my private, physical LAN, I run `tcpdump -i ens7`, and this is what I see

```
22:28:15.528259 ARP, Request who-has root-alice-sgp-01.zerotier.com tell 10.112.128.10, length 28
22:28:16.556756 ARP, Request who-has root-alice-sgp-01.zerotier.com tell 10.112.128.10, length 28
22:28:17.580809 ARP, Request who-has root-alice-sgp-01.zerotier.com tell 10.112.128.10, length 28
22:28:20.535154 ARP, Request who-has root-bob-tok-01.zerotier.com tell 10.112.128.10, length 28
22:28:20.535385 ARP, Request who-has root-alice-sao-01.zerotier.com tell 10.112.128.10, length 28
22:28:21.548867 ARP, Request who-has root-alice-sao-01.zerotier.com tell 10.112.128.10, length 28
22:28:21.548891 ARP, Request who-has root-bob-tok-01.zerotier.com tell 10.112.128.10, length 28
22:28:22.572812 ARP, Request who-has root-bob-tok-01.zerotier.com tell 10.112.128.10, length 28
22:28:22.572835 ARP, Request who-has root-alice-sao-01.zerotier.com tell 10.112.128.10, length 28
```

Is this behavior intended or is this a problem with my configuration? `ens7` does not have default route or anything strange, just a static private RFC1918 IP. I am running version 1.2.8.

**Comment by d0wnblog** [comment]
Got the exact same problem... when I try to ping I see only arp requests with tcpdump...

**Comment by glimberg** [comment]
This is by design.  ZeroTier will try to use all interfaces to contact peers.

If you wish to prohibit ZeroTier from using specific interfaces, you can add set the `interfacePrefixBlacklist` option in `local.conf`

Example for `ens7`
```
{
  "settings": {
    "interfacePrefixBlacklist": [ "ens7" ]
  }
}
```
