### ISSUE TITLE
zerotier-one mass sending udp to unknown IPs

### ISSUE THREAD

**Issue by haphan** [zerotier/ZeroTierOne#788]
I spotted unusual traffic hitting the external firewall, after troubleshooting, looks like zerotier is sending UDP to an unknown IP range to our networks e.g. `192.168.41.1` and `192.168.42.1`

zerotire network is configured to use `172.29.0.0/16` range.

I am happy to provide pcap file as well if need for further investigation.
```
17:16:21.102346 IP kvm.palace-2 > 192.168.42.1.palace-2: UDP, length 28
17:16:21.102369 IP kvm.53240 > 192.168.42.1.palace-2: UDP, length 28
17:16:21.102384 IP kvm.53241 > 192.168.42.1.palace-2: UDP, length 28
17:16:21.102837 IP kvm.palace-2 > 192.168.43.1.palace-2: UDP, length 28
17:16:21.102864 IP kvm.53240 > 192.168.43.1.palace-2: UDP, length 28
17:16:21.102882 IP kvm.53241 > 192.168.43.1.palace-2: UDP, length 28
17:16:21.103019 IP 103.206.25.161 > kvm: ICMP host 192.168.42.1 unreachable - admin prohibited filter, length 76
17:16:21.103346 IP kvm.palace-2 > 192.168.42.1.42253: UDP, length 28
17:16:21.103365 IP kvm.53240 > 192.168.42.1.42253: UDP, length 28
17:16:21.103380 IP kvm.53241 > 192.168.42.1.42253: UDP, length 28
17:16:21.103832 IP kvm.palace-2 > 192.168.43.1.42253: UDP, length 28
17:16:21.103851 IP kvm.53240 > 192.168.43.1.42253: UDP, length 28
17:16:21.103866 IP kvm.53241 > 192.168.43.1.42253: UDP, length 28
17:16:21.104322 IP kvm.palace-2 > 192.168.42.1.42254: UDP, length 28
17:16:21.104342 IP kvm.53240 > 192.168.42.1.42254: UDP, length 28
17:16:21.104358 IP kvm.53241 > 192.168.42.1.42254: UDP, length 28
17:16:21.104812 IP kvm.palace-2 > 192.168.43.1.42254: UDP, length 28
17:16:21.104831 IP kvm.53240 > 192.168.43.1.42254: UDP, length 28
17:16:21.104846 IP kvm.53241 > 192.168.43.1.42254: UDP, length 28
17:16:21.105302 IP kvm.palace-2 > 192.168.1.145.palace-2: UDP, length 28
17:16:21.105324 IP kvm.53240 > 192.168.1.145.palace-2: UDP, length 28
17:16:21.105340 IP kvm.53241 > 192.168.1.145.palace-2: UDP, length 28
17:16:21.105792 IP kvm.palace-2 > 192.168.1.145.42253: UDP, length 28
17:16:21.105811 IP kvm.53240 > 192.168.1.145.42253: UDP, length 28
17:16:21.105829 IP kvm.53241 > 192.168.1.145.42253: UDP, length 28
17:16:22.931927 IP 1dot1dot1dot1.cloudflare-dns.com.domain > kvm.49482: 11098 NXDomain 0/1/0 (154)
17:17:21.188192 IP kvm.53241 > 101.127.226.35.palace-2: UDP, length 118
17:17:22.428998 IP kvm.palace-2 > 192.168.42.1.palace-2: UDP, length 28
17:17:22.429018 IP kvm.53240 > 192.168.42.1.palace-2: UDP, length 28
17:17:22.429034 IP kvm.53241 > 192.168.42.1.palace-2: UDP, length 28
17:17:22.429494 IP kvm.palace-2 > 192.168.43.1.palace-2: UDP, length 28
17:17:22.429514 IP kvm.53240 > 192.168.43.1.palace-2: UDP, length 28
17:17:22.429529 IP kvm.53241 > 192.168.43.1.palace-2: UDP, length 28
17:17:22.430448 IP kvm.palace-2 > 192.168.42.1.47128: UDP, length 28
17:17:22.430465 IP kvm.53240 > 192.168.42.1.47128: UDP, length 28
17:17:22.430480 IP kvm.53241 > 192.168.42.1.47128: UDP, length 28
17:17:22.430919 IP kvm.palace-2 > 192.168.43.1.47128: UDP, length 28
17:17:22.430936 IP kvm.53240 > 192.168.43.1.47128: UDP, length 28
17:17:22.430951 IP kvm.53241 > 192.168.43.1.47128: UDP, length 28
17:17:22.431864 IP kvm.palace-2 > 192.168.42.1.47129: UDP, length 28
17:17:22.431882 IP kvm.53240 > 192.168.42.1.47129: UDP, length 28
17:17:22.431896 IP kvm.53241 > 192.168.42.1.47129: UDP, length 28
```

```
zerotier-  5796 zerotier-one    6u  IPv4 1117411      0t0  TCP localhost:palace-2 (LISTEN)
zerotier-  5796 zerotier-one    7u  IPv6 1117412      0t0  TCP localhost:palace-2 (LISTEN)
zerotier-  5796 zerotier-one    8u  IPv4 1927085      0t0  UDP kvm:palace-2
zerotier-  5796 zerotier-one    9u  IPv4 1927086      0t0  TCP kvm:palace-2 (LISTEN)
zerotier-  5796 zerotier-one   10u  IPv4 1927087      0t0  UDP kvm:53240
zerotier-  5796 zerotier-one   11u  IPv4 1117420      0t0  UDP kvm:palace-2
zerotier-  5796 zerotier-one   12u  IPv4 1117421      0t0  TCP kvm:palace-2 (LISTEN)
zerotier-  5796 zerotier-one   13u  IPv4 1117422      0t0  UDP kvm:palace-2
zerotier-  5796 zerotier-one   14u  IPv4 1117423      0t0  TCP kvm:palace-2 (LISTEN)
zerotier-  5796 zerotier-one   15u  IPv4 1927088      0t0  TCP kvm:53240 (LISTEN)
zerotier-  5796 zerotier-one   16u  IPv4 1927089      0t0  UDP kvm:53241
zerotier-  5796 zerotier-one   17u  IPv4 1117426      0t0  UDP kvm:53240
zerotier-  5796 zerotier-one   18u  IPv4 1117427      0t0  TCP kvm:53240 (LISTEN)
zerotier-  5796 zerotier-one   19u  IPv4 1117428      0t0  UDP kvm:53240
zerotier-  5796 zerotier-one   20u  IPv4 1117429      0t0  TCP kvm:53240 (LISTEN)
zerotier-  5796 zerotier-one   21u  IPv4 1927090      0t0  TCP kvm:53241 (LISTEN)
zerotier-  5796 zerotier-one   23u  IPv4 1117432      0t0  UDP kvm:53241
zerotier-  5796 zerotier-one   24u  IPv4 1117433      0t0  TCP kvm:53241 (LISTEN)
zerotier-  5796 zerotier-one   25u  IPv4 1117434      0t0  UDP kvm:53241
zerotier-  5796 zerotier-one   26u  IPv4 1117435      0t0  TCP kvm:53241 (LISTEN)
```

**Comment by glimberg** [comment]
I'm assuming you're running on linux here.  What's the output of `ip route list` and `ip addr list`?

**Comment by haphan** [comment]
@glimberg Yes it is a rhel linux. 

```
[root@kvm kvm]# ip route list
default via 172.16.151.1 dev br0 proto static metric 426
172.16.150.0/24 dev br150 proto kernel scope link src 172.16.150.116 metric 427
172.16.151.0/24 dev br0 proto kernel scope link src 172.16.151.116 metric 426
172.16.160.0/24 dev enp129s0f1 proto kernel scope link src 172.16.160.116 metric 101
172.29.0.0/16 dev ztwfuhzfof scope link
```

```
[root@kvm kvm]# ip addr list
1: lo: <LOOPBACK,UP,LOWER_UP> mtu 65536 qdisc noqueue state UNKNOWN group default qlen 1000
    link/loopback 00:00:00:00:00:00 brd 00:00:00:00:00:00
    inet 127.0.0.1/8 scope host lo
       valid_lft forever preferred_lft forever
    inet6 ::1/128 scope host
       valid_lft forever preferred_lft forever
2: enp4s0f0: <BROADCAST,MULTICAST,UP,LOWER_UP> mtu 1500 qdisc mq master team0 state UP group default qlen 1000
    link/ether e0:36:76:cf:ef:d9 brd ff:ff:ff:ff:ff:ff
3: enp4s0f1: <BROADCAST,MULTICAST,UP,LOWER_UP> mtu 1500 qdisc mq master team0 state UP group default qlen 1000
    link/ether e0:36:76:cf:ef:d9 brd ff:ff:ff:ff:ff:ff
4: enp129s0f0: <BROADCAST,MULTICAST,UP,LOWER_UP> mtu 1500 qdisc mq master br150 state UP group default qlen 1000
    link/ether e0:36:76:cf:f6:8e brd ff:ff:ff:ff:ff:ff
5: enp129s0f1: <BROADCAST,MULTICAST,UP,LOWER_UP> mtu 1500 qdisc mq state UP group default qlen 1000
    link/ether e0:36:76:cf:f6:92 brd ff:ff:ff:ff:ff:ff
    inet 172.16.160.116/24 brd 172.16.160.255 scope global noprefixroute enp129s0f1
       valid_lft forever preferred_lft forever
    inet6 fe80::cbb:3496:f7aa:9bce/64 scope link noprefixroute
       valid_lft forever preferred_lft forever
6: virbr0: <BROADCAST,MULTICAST> mtu 1500 qdisc noqueue state DOWN group default qlen 1000
    link/ether 52:54:00:af:c2:f5 brd ff:ff:ff:ff:ff:ff
7: virbr0-nic: <BROADCAST,MULTICAST> mtu 1500 qdisc pfifo_fast master virbr0 state DOWN group default qlen 1000
    link/ether 52:54:00:af:c2:f5 brd ff:ff:ff:ff:ff:ff
16: team0: <BROADCAST,MULTICAST,UP,LOWER_UP> mtu 1500 qdisc noqueue master br0 state UP group default qlen 1000
    link/ether e0:36:76:cf:ef:d9 brd ff:ff:ff:ff:ff:ff
18: br0: <BROADCAST,MULTICAST,UP,LOWER_UP> mtu 1500 qdisc noqueue state UP group default qlen 1000
    link/ether e0:36:76:cf:ef:d9 brd ff:ff:ff:ff:ff:ff
    inet 172.16.151.116/24 brd 172.16.151.255 scope global noprefixroute br0
       valid_lft forever preferred_lft forever
    inet6 fe80::6333:bb24:977e:f245/64 scope link tentative dadfailed
       valid_lft forever preferred_lft forever
    inet6 fe80::c342:7ccc:34a0:ef76/64 scope link tentative dadfailed
       valid_lft forever preferred_lft forever
    inet6 fe80::aa8b:83fd:71d8:8954/64 scope link tentative dadfailed
       valid_lft forever preferred_lft forever
28: ztwfuhzfof: <BROADCAST,MULTICAST,UP,LOWER_UP> mtu 2800 qdisc pfifo_fast state UNKNOWN group default qlen 1000
    link/ether 76:71:79:ce:25:b7 brd ff:ff:ff:ff:ff:ff
    inet 172.29.197.59/16 brd 172.29.255.255 scope global ztwfuhzfof
       valid_lft forever preferred_lft forever
    inet 172.29.197.254/16 brd 172.29.255.255 scope global secondary ztwfuhzfof
       valid_lft forever preferred_lft forever
    inet6 fc56:d2b4:22b1:717c:70c3::1/40 scope global
       valid_lft forever preferred_lft forever
    inet6 fe80::7471:79ff:fece:25b7/64 scope link
       valid_lft forever preferred_lft forever
42: vnet0: <BROADCAST,MULTICAST,UP,LOWER_UP> mtu 1500 qdisc pfifo_fast master br150 state UNKNOWN group default qlen 1000
    link/ether fe:54:00:75:8e:75 brd ff:ff:ff:ff:ff:ff
    inet6 fe80::fc54:ff:fe75:8e75/64 scope link
       valid_lft forever preferred_lft forever
43: vnet1: <BROADCAST,MULTICAST,UP,LOWER_UP> mtu 1500 qdisc pfifo_fast master br150 state UNKNOWN group default qlen 1000
    link/ether fe:54:00:b7:62:29 brd ff:ff:ff:ff:ff:ff
    inet6 fe80::fc54:ff:feb7:6229/64 scope link
       valid_lft forever preferred_lft forever
46: br150: <BROADCAST,MULTICAST,UP,LOWER_UP> mtu 1500 qdisc noqueue state UP group default qlen 1000
    link/ether e0:36:76:cf:f6:8e brd ff:ff:ff:ff:ff:ff
    inet 172.16.150.116/24 brd 172.16.150.255 scope global noprefixroute br150
       valid_lft forever preferred_lft forever
    inet6 fe80::e221:e2b5:ca6d:8bd2/64 scope link noprefixroute
       valid_lft forever preferred_lft forever
```

**Comment by janjaapbos** [comment]
There is probably peer that has reported an address in that range. Now your node tries to establish a direct path. You can exclude that range in your local.conf if you want.

**Comment by adamierymenko** [comment]
Yes, Janjaap is right. This is not a bug. It's a feature.

This is known in the P2P networking world as the "same network problem." How do you detect that two clients are on the same LAN or larger-scale local network (e.g. campus network) and use that instead of having to go out over the Internet for communication between local clients?

Multicast/broadcast doesn't work reliably for this at all. Most of the time it only works over local Ethernet segments. Most sites don't bother to route it anywhere. It also doesn't work on the vast majority of cloud backplanes including Amazon, Google, and Microsoft Azure cloud networks.

The *only* way to do this reliably is to have clients tell each other about local IPs and then try them blindly. This is only done between clients that have a trust relationship, which in our system means clients that belong to the same virtual network. ZeroTier stops doing this once it establishes a direct link, but while attempting to do so it will send local packets to what are likely to be non-existent local IPs if those are reported by peers to whom it is communicating but lacks a direct path.

We really wish there were a better way to do this, but there isn't. This is how today's networks are deployed. There is no alternative.
