### ISSUE TITLE
Random connection issues between Hetzner and Oracle Cloud

### ISSUE THREAD

**Issue by misuzu** [zerotier/ZeroTierOne#1061]
**Describe the bug**

Sometimes there is some strange connection issues between my peers. There is a direct connection between them and packets is sent and received but zerotier is ignoring them or something. Restarts/reboots are not helping.

Oracle Cloud peer:
```bash
~ > sudo iptables -I INPUT -s 95.216.157.15/32 -j ACCEPT
~ > sudo tcpdump -n -i ens3 host 95.216.157.15 -s 0 -w p1.pcap

# in other tty
~ > ping 95.216.157.15
PING 95.216.157.15 (95.216.157.15) 56(84) bytes of data.
64 bytes from 95.216.157.15: icmp_seq=1 ttl=52 time=32.2 ms
64 bytes from 95.216.157.15: icmp_seq=2 ttl=52 time=32.0 ms
64 bytes from 95.216.157.15: icmp_seq=3 ttl=52 time=31.9 ms
^C
--- 95.216.157.15 ping statistics ---
3 packets transmitted, 3 received, 0% packet loss, time 2002ms
rtt min/avg/max/mdev = 31.905/32.020/32.195/0.125 ms
~ > sudo zerotier-cli info
200 info f76a653ea2 1.4.6 ONLINE
~ > sudo zerotier-cli listpeers | grep d04d3ee042
200 listpeers d04d3ee042 95.216.157.15/9993;9256;9256 40 1.4.6 LEAF
~ > ping fca1:539e:f3d0:4d3e:e042::1
PING fca1:539e:f3d0:4d3e:e042::1(fca1:539e:f3d0:4d3e:e042::1) 56 data bytes
^C
--- fca1:539e:f3d0:4d3e:e042::1 ping statistics ---
8 packets transmitted, 0 received, 100% packet loss, time 7183ms
```

Hetzner peer:
```bash
~ > sudo iptables -I INPUT -s 132.145.58.20/32 -j ACCEPT
~ > sudo tcpdump -n -i ens3 host 132.145.58.20 -s 0 -w p2.pcap

# in other tty
~ > ping 132.145.58.20
PING 132.145.58.20 (132.145.58.20) 56(84) bytes of data.
64 bytes from 132.145.58.20: icmp_seq=1 ttl=51 time=32.9 ms
64 bytes from 132.145.58.20: icmp_seq=2 ttl=51 time=32.7 ms
64 bytes from 132.145.58.20: icmp_seq=3 ttl=51 time=32.7 ms
^C
--- 132.145.58.20 ping statistics ---
3 packets transmitted, 3 received, 0% packet loss, time 2003ms
rtt min/avg/max/mdev = 32.697/32.768/32.892/0.087 ms
~ > sudo zerotier-cli info
200 info d04d3ee042 1.4.6 ONLINE
~ > sudo zerotier-cli listpeers | grep f76a653ea2
200 listpeers f76a653ea2 132.145.58.20/29567;8799;8758 48 1.4.6 LEAF
~ > ping fca1:539e:f3f7:6a65:3ea2::1
PING fca1:539e:f3f7:6a65:3ea2::1(fca1:539e:f3f7:6a65:3ea2::1) 56 data bytes
From fca1:539e:f3d0:4d3e:e042::1 icmp_seq=1 Destination unreachable: Address unreachable
From fca1:539e:f3d0:4d3e:e042::1 icmp_seq=2 Destination unreachable: Address unreachable
^C
--- fca1:539e:f3f7:6a65:3ea2::1 ping statistics ---
4 packets transmitted, 0 received, +2 errors, 100% packet loss, time 3064ms
```

Pcap files: [tcpdump.zip](https://github.com/zerotier/ZeroTierOne/files/3741229/tcpdump.zip)

**To Reproduce**
Unknown

**Expected behavior**
Ping between peers must succeed.

**Desktop (please complete the following information):**
 - OS: Linux
 - OS/Distribution Version: NixOS 19.09.840.8bf142e001b
 - ZeroTier Version: 1.4.6
 - Hardware: QEMU

**Comment by misuzu** [comment]
Oracle Cloud peer:

```bash
~ > ping fca1:539e:f3d0:4d3e:e042::1
PING fca1:539e:f3d0:4d3e:e042::1(fca1:539e:f3d0:4d3e:e042::1) 56 data bytes
^C
--- fca1:539e:f3d0:4d3e:e042::1 ping statistics ---
9 packets transmitted, 0 received, 100% packet loss, time 8222ms

# in other tty
~ > sudo tcpdump -n -i ztuze5qw7u ip6 host fca1:539e:f3d0:4d3e:e042::1
tcpdump: verbose output suppressed, use -v or -vv for full protocol decode
listening on ztuze5qw7u, link-type EN10MB (Ethernet), capture size 262144 bytes
23:48:02.118656 IP6 fca1:539e:f3f7:6a65:3ea2::1 > fca1:539e:f3d0:4d3e:e042::1: ICMP6, echo request, seq 3, length 64
23:48:03.142625 IP6 fca1:539e:f3f7:6a65:3ea2::1 > fca1:539e:f3d0:4d3e:e042::1: ICMP6, echo request, seq 4, length 64
23:48:04.166660 IP6 fca1:539e:f3f7:6a65:3ea2::1 > fca1:539e:f3d0:4d3e:e042::1: ICMP6, echo request, seq 5, length 64
23:48:05.190619 IP6 fca1:539e:f3f7:6a65:3ea2::1 > fca1:539e:f3d0:4d3e:e042::1: ICMP6, echo request, seq 6, length 64
23:48:06.214598 IP6 fca1:539e:f3f7:6a65:3ea2::1 > fca1:539e:f3d0:4d3e:e042::1: ICMP6, echo request, seq 7, length 64
23:48:07.238671 IP6 fca1:539e:f3f7:6a65:3ea2::1 > fca1:539e:f3d0:4d3e:e042::1: ICMP6, echo request, seq 8, length 64
23:48:07.622543 IP6 fe80::c895:4eff:fe5b:75e > fca1:539e:f3d0:4d3e:e042::1: ICMP6, neighbor solicitation, who has fca1:539e:f3d0:4d3e:e042::1, length 32
23:48:08.263593 IP6 fca1:539e:f3f7:6a65:3ea2::1 > fca1:539e:f3d0:4d3e:e042::1: ICMP6, echo request, seq 9, length 64
23:48:08.646572 IP6 fe80::c895:4eff:fe5b:75e > fca1:539e:f3d0:4d3e:e042::1: ICMP6, neighbor solicitation, who has fca1:539e:f3d0:4d3e:e042::1, length 32
23:48:09.670556 IP6 fe80::c895:4eff:fe5b:75e > fca1:539e:f3d0:4d3e:e042::1: ICMP6, neighbor solicitation, who has fca1:539e:f3d0:4d3e:e042::1, length 32
^C
10 packets captured
10 packets received by filter
0 packets dropped by kernel
```

Hetzner peer:

```bash
~ > ping fca1:539e:f3f7:6a65:3ea2::
PING fca1:539e:f3f7:6a65:3ea2::1(fca1:539e:f3f7:6a65:3ea2::1) 56 data bytes
From fca1:539e:f3d0:4d3e:e042::1 icmp_seq=1 Destination unreachable: Address unreachable
From fca1:539e:f3d0:4d3e:e042::1 icmp_seq=2 Destination unreachable: Address unreachable
From fca1:539e:f3d0:4d3e:e042::1 icmp_seq=3 Destination unreachable: Address unreachable
^C
--- fca1:539e:f3f7:6a65:3ea2::1 ping statistics ---
5 packets transmitted, 0 received, +3 errors, 100% packet loss, time 4105ms

# in other tty
~ > sudo tcpdump -n -i ztuze5qw7u ip6
tcpdump: verbose output suppressed, use -v or -vv for full protocol decode
listening on ztuze5qw7u, link-type EN10MB (Ethernet), capture size 262144 bytes
23:52:26.460054 IP6 fca1:539e:f3d0:4d3e:e042::1 > ff02::1:ff00:1: ICMP6, neighbor solicitation, who has fca1:539e:f3f7:6a65:3ea2::1, length 32
23:52:27.493073 IP6 fca1:539e:f3d0:4d3e:e042::1 > ff02::1:ff00:1: ICMP6, neighbor solicitation, who has fca1:539e:f3f7:6a65:3ea2::1, length 32
23:52:28.517110 IP6 fca1:539e:f3d0:4d3e:e042::1 > ff02::1:ff00:1: ICMP6, neighbor solicitation, who has fca1:539e:f3f7:6a65:3ea2::1, length 32
23:52:29.541656 IP6 fca1:539e:f3d0:4d3e:e042::1 > ff02::1:ff00:1: ICMP6, neighbor solicitation, who has fca1:539e:f3f7:6a65:3ea2::1, length 32
23:52:30.565081 IP6 fca1:539e:f3d0:4d3e:e042::1 > ff02::1:ff00:1: ICMP6, neighbor solicitation, who has fca1:539e:f3f7:6a65:3ea2::1, length 32
23:52:31.589007 IP6 fca1:539e:f3d0:4d3e:e042::1 > ff02::1:ff00:1: ICMP6, neighbor solicitation, who has fca1:539e:f3f7:6a65:3ea2::1, length 32
^C
6 packets captured
6 packets received by filter
0 packets dropped by kernel
```

**Comment by misuzu** [comment]
Fixed by deleting identity files.
