### ISSUE TITLE
zerotier does not use tcp relay unless forceTcpRelay is set to true

### ISSUE THREAD

**Issue by Mic92** [zerotier/ZeroTierOne#2203]
## Please let us know

- What you expect to be happening.

After the 60 second timeout zerotier should be able to use tcp relay to connect to planets/moon.

- What is actually happening?

```console
$ sudo zerotier-cli peers
200 peers
<ztaddr>   <ver>  <role> <lat> <link>   <lastTX> <lastRX> <path>
267efd4a15 -      MOON      -1 RELAY
62f865ae71 -      PLANET    -1 RELAY
778cde7190 -      PLANET    -1 RELAY
7c31a21e86 -      LEAF      -1 RELAY
cafe04eba9 -      PLANET    -1 RELAY
cafe9efeb9 -      PLANET    -1 RELAY
```

After forceTcpRelay and set my own tcp relay it works:

```json
{
  "settings": {
    "forceTcpRelay": true,
    "tcpFallbackRelay": "95.217.199.121/4443"
  }
}
```

```console
$ sudo zerotier-cli peers
200 peers
<ztaddr>   <ver>  <role> <lat> <link>   <lastTX> <lastRX> <path>
0fc5c5cbce 1.12.2 LEAF      -1 RELAY 2057     2057     95.216.1.150/9993
267efd4a15 1.12.2 MOON      75 RELAY 611      611      95.217.199.121/9993
62f865ae71 -      PLANET   257 RELAY 9088     9392     50.7.252.138/9993
778cde7190 -      PLANET   164 RELAY 9088     9485     103.195.103.66/9993
7c31a21e86 -      LEAF      -1 RELAY
a03b47494d 1.12.2 LEAF     192 RELAY 3081     5598     89.58.27.144/9993
cafe04eba9 -      PLANET   103 RELAY 5087     4448     84.17.53.155/9993
cafe9efeb9 -      PLANET   295 RELAY 9088     9354     104.194.8.134/9993
e9c5fcc8b5 1.12.2 LEAF     146 RELAY 649      649      91.64.38.235/65394
```

- Any steps to reproduce the error.

1. Setup a network UDP is blocked without ICMP error messages:

```console
[root@blob64:~]# nc -uv 89.58.27.144 9993
Connection to 89.58.27.144 9993 port [udp/palace-2] succeeded!
```

Here is the relevant tcpdump

```console
[root@blob64:~]# tcpdump -i any -n host 89.58.27.144 and port 9993
tcpdump: data link type LINUX_SLL2
tcpdump: verbose output suppressed, use -v[v]... for full protocol decode
listening on any, link-type LINUX_SLL2 (Linux cooked v2), snapshot length 262144 bytes
o10:44:56.929371 end0  Out IP 131.159.38.25.32803 > 89.58.27.144.9993: UDP, length 1
10:44:56.929400 end0  Out IP 131.159.38.25.32803 > 89.58.27.144.9993: UDP, length 1
10:44:56.929410 end0  Out IP 131.159.38.25.32803 > 89.58.27.144.9993: UDP, length 1
10:44:56.929421 end0  Out IP 131.159.38.25.32803 > 89.58.27.144.9993: UDP, length 1
10:45:12.950078 end0  Out IP 131.159.38.25.52418 > 89.58.27.144.9993: UDP, length 1
10:45:12.950108 end0  Out IP 131.159.38.25.52418 > 89.58.27.144.9993: UDP, length 1
10:45:12.950119 end0  Out IP 131.159.38.25.52418 > 89.58.27.144.9993: UDP, length 1
10:45:12.950129 end0  Out IP 131.159.38.25.52418 > 89.58.27.144.9993: UDP, length 1
```

- What operating system and ZeroTier version. Please try the latest ZeroTier release. 

```console
[root@blob64:~]# zerotier-cli  --version
ZeroTier One version 1.12.2 build 0 (platform 1 arch 4)
Copyright (c) 2020 ZeroTier, Inc.
Licensed under the ZeroTier BSL 1.1 (see LICENSE.txt)
Usage: zerotier-cli [-switches] <command/path> [<args>]
```
